{
  "schema_version": "1.2",
  "stage": "long",
  "state": "draft",
  "path": "papers/long.md",
  "content_sha256": "5b01d2e2a0b9c9599244b0d0867096a6f9e946e8b143895de5d87aa639a302b5",
  "graph_sha256": "d50b9164c653678bad45f0f573e2946db8be23255a316a205d4fb829be4148ad",
  "selected_goal_ids": [
    "full_support",
    "scalar_value",
    "qaoa_thermodynamic_first"
  ],
  "claim_ids": [
    "circuit.additive_responses",
    "circuit.bounded_trigonometric",
    "circuit.classical_fixed_minimizer",
    "circuit.classical_positive",
    "circuit.classical_primary",
    "circuit.classical_strong_limit",
    "circuit.color_exclusion",
    "circuit.energy_transfer",
    "circuit.even_p_spin_obstruction",
    "circuit.external_mode_energy",
    "circuit.finite_formula_word_approximation",
    "circuit.fixed_word_concentration",
    "circuit.fixed_word_transfer",
    "circuit.gate_calculus",
    "circuit.gaussian_root_calculus",
    "circuit.helper_contraction",
    "circuit.high_girth_maxcut",
    "circuit.later_finite_size_comparison",
    "circuit.masked_controls",
    "circuit.one_measurement_near_optimum",
    "circuit.ordinary_updates",
    "circuit.ordinary_word_positive",
    "circuit.ordinary_word_primary",
    "circuit.orthogonal_quadratics",
    "circuit.positive_finite_step",
    "circuit.positive_input",
    "circuit.positive_mesh",
    "circuit.positive_rooted_clipping",
    "circuit.positive_value",
    "circuit.rooted_realization",
    "circuit.sampled_finite_instance_optimum",
    "circuit.seed_packets",
    "circuit.seed_removal",
    "circuit.seeded_synthesis",
    "circuit.selective_accuracy",
    "circuit.selective_control",
    "circuit.sign_smoothing",
    "circuit.singular_echo",
    "circuit.upper_bound_padding",
    "circuit.visibility",
    "circuit.weighted_finite_horizon",
    "circuit.weighted_unitary_calculus",
    "full_support",
    "lean.full_support",
    "lean.value_consequences",
    "qaoa_thermodynamic_first",
    "scalar.conditional_rounding",
    "scalar.correlation_vector_control",
    "scalar.euler_normalization",
    "scalar.finite_gibbs_comparison",
    "scalar.finite_maximum_concentration",
    "scalar.finite_maximum_unique_modulo_flip",
    "scalar.fixed_strip_error_budget",
    "scalar.formal_contact_input",
    "scalar.formal_finite_gaussian_clause",
    "scalar.formal_model_transport_open",
    "scalar.formal_parisi_clause",
    "scalar.formal_scalar_clause",
    "scalar.lean_gaussian_target",
    "scalar.lean_parisi_target",
    "scalar.lean_scalar_target",
    "scalar.manuscript_terminal_value",
    "scalar.minimizer_attainment",
    "scalar.minimizer_coefficient_budget",
    "scalar.minimizer_total_coefficient_mass",
    "scalar.parisi_formula",
    "scalar.separate_classical_algorithm",
    "scalar.shifted_gaussian_limit",
    "scalar.smooth_positive_density",
    "scalar.source_diffusion_exists",
    "scalar.source_empirical_energy_limit",
    "scalar.source_finite_adaptive_lower",
    "scalar.source_fixed_strip_application",
    "scalar.source_gaussian_column_split",
    "scalar.source_ground_state_identity_with_diffusion",
    "scalar.source_ground_state_upper",
    "scalar.source_minimizer_curvature_moment",
    "scalar.source_predictable_lower",
    "scalar.source_spin_sequence_limit",
    "scalar.source_strip_regularity",
    "scalar.source_strip_value_lower",
    "scalar.source_terminal_parisi_assembly",
    "scalar.terminal_loss",
    "scalar.unshifted_gaussian_limit",
    "scalar_value",
    "support.backward_shapes",
    "support.contact",
    "support.contact_derivatives",
    "support.diffusion",
    "support.empty_support_chord_obstruction",
    "support.first_variation",
    "support.fixed_time_spatial_coercivity",
    "support.fixed_time_spatial_coercivity_at_jumps",
    "support.flux_identity",
    "support.forward_shapes",
    "support.full_relative_support",
    "support.full_relative_support_curvature",
    "support.integrated_coercivity",
    "support.moment_identity",
    "support.moment_saturation",
    "support.near_ground_pairs",
    "support.no_bounded_gap",
    "support.no_initial_gap",
    "support.no_terminal_gap",
    "support.optimality_criterion",
    "support.plateau_transfer",
    "support.positive_curvature",
    "support.rational_certificate",
    "support.raw_curvature_negative_absolute_terminal",
    "support.regularity",
    "support.source_finite_density_coercivity",
    "support.step_tails",
    "support.stieltjes_measure",
    "support.terminal_chord_barrier",
    "support.zero_candidate_descent",
    "support.zero_curvature"
  ],
  "citation_ids": [
    "ac2015_unique_minimizer",
    "ac2017_ground_state",
    "acz2020_infinite_support",
    "acz2020_near_ground_pairs",
    "authored_bounded_angle_depth_comparison",
    "authored_gibbs_comparison",
    "authored_r10_empty_support_chord",
    "authored_r10_finite_maximizer_uniqueness",
    "authored_r8_circuit_sampled_finite_instance_optimum",
    "authored_r8_scalar_finite_maximum_concentration",
    "authored_r8_scalar_minimizer_coefficient_budget",
    "authored_r8_scaling_contact",
    "authored_r8_support_fixed_time_spatial_coercivity_at_jumps",
    "authored_r8_support_full_relative_support_curvature",
    "authored_r8_support_terminal_chord_barrier",
    "authored_r8_support_zero_candidate_descent",
    "authored_r8_unshifted_gaussian",
    "authored_r9_finite_formula_word",
    "authored_r9_scalar_minimizer_total_coefficient_mass",
    "authored_r9_support_raw_curvature_negative_absolute_terminal",
    "bfmvz2022_tree_transfer",
    "bgmz2022_even_spin_obstruction",
    "boulebnane2026_spin_boson_v2",
    "chen2026_full_support",
    "chl2018_zero_temperature",
    "circuit-r2-26-cite-additive-responses",
    "circuit-r2-26-cite-bounded-trigonometric",
    "circuit-r2-26-cite-classical-fixed-minimizer",
    "circuit-r2-26-cite-classical-positive",
    "circuit-r2-26-cite-classical-primary",
    "circuit-r2-26-cite-classical-strong-limit",
    "circuit-r2-26-cite-color-exclusion",
    "circuit-r2-26-cite-energy-transfer",
    "circuit-r2-26-cite-external-mode-energy",
    "circuit-r2-26-cite-fixed-word-transfer",
    "circuit-r2-26-cite-gate-calculus",
    "circuit-r2-26-cite-gaussian-root-calculus",
    "circuit-r2-26-cite-helper-contraction",
    "circuit-r2-26-cite-high-girth-maxcut",
    "circuit-r2-26-cite-masked-controls",
    "circuit-r2-26-cite-ordinary-updates",
    "circuit-r2-26-cite-ordinary-word-positive",
    "circuit-r2-26-cite-ordinary-word-primary",
    "circuit-r2-26-cite-orthogonal-quadratics",
    "circuit-r2-26-cite-positive-finite-step",
    "circuit-r2-26-cite-positive-input",
    "circuit-r2-26-cite-positive-mesh",
    "circuit-r2-26-cite-positive-rooted-clipping",
    "circuit-r2-26-cite-positive-value",
    "circuit-r2-26-cite-rooted-realization",
    "circuit-r2-26-cite-seed-packets",
    "circuit-r2-26-cite-seed-removal",
    "circuit-r2-26-cite-seeded-synthesis",
    "circuit-r2-26-cite-selective-accuracy",
    "circuit-r2-26-cite-selective-control",
    "circuit-r2-26-cite-sign-smoothing",
    "circuit-r2-26-cite-singular-echo",
    "circuit-r2-26-cite-upper-bound-padding",
    "circuit-r2-26-cite-visibility",
    "circuit-r2-26-cite-weighted-unitary-calculus",
    "eams2021_mean_field_optimization",
    "eams2023_finite_step",
    "fggz2022_fixed_depth",
    "full_support_chord_derivative",
    "full_support_comparator",
    "full_support_implementation",
    "full_support_manuscript",
    "full_support_origin_coercivity",
    "full_support_type",
    "jt2016_dynamic_programming",
    "lopatto2026_interval_support",
    "montanari2025_sk_optimization",
    "qaoa_finite_size_corollary",
    "qaoa_main_theorem",
    "qaoa_manuscript_arguments",
    "qaoa_original_2014",
    "qaoa_routes",
    "scalar-r2-13-cite-diffusion-exists",
    "scalar-r2-13-cite-fixed-strip-application",
    "scalar-r2-13-cite-ground-state-identity-with-diffusion",
    "scalar-r2-13-cite-ground-state-upper",
    "scalar-r2-13-cite-minimizer-curvature-moment",
    "scalar-r2-13-cite-spin-sequence-limit",
    "scalar-r2-13-cite-strip-regularity",
    "scalar-r2-13-cite-strip-value-lower",
    "scalar-r2-13-cite-terminal-parisi-assembly",
    "scalar-r2-26-cite-conditional-fixed-strip",
    "scalar-r2-26-cite-conditional-rounding",
    "scalar-r2-26-cite-correlation-vector-control",
    "scalar-r2-26-cite-eams-algorithm",
    "scalar-r2-26-cite-euler-normalization",
    "scalar-r2-26-cite-formal-contact-input",
    "scalar-r2-26-cite-formal-finite-gaussian-clause",
    "scalar-r2-26-cite-formal-model-transport-open",
    "scalar-r2-26-cite-formal-parisi-clause",
    "scalar-r2-26-cite-formal-scalar-clause",
    "scalar-r2-26-cite-lean-gaussian-target",
    "scalar-r2-26-cite-lean-parisi-target",
    "scalar-r2-26-cite-lean-scalar-target",
    "scalar-r2-26-cite-manuscript-terminal-value",
    "scalar-r2-26-cite-minimizer-attainment",
    "scalar-r2-26-cite-paper-admissible",
    "scalar-r2-26-cite-paper-minimizer",
    "scalar-r2-26-cite-parisi-formula",
    "scalar-r2-26-cite-separate-classical-algorithm",
    "scalar-r2-26-cite-shifted-gaussian-limit",
    "scalar-r2-26-cite-smooth-positive-density",
    "scalar-r2-26-cite-terminal-loss",
    "scalar-r2-26-cite-transport-support-model",
    "scalar.source_empirical_energy_limit_lean_source",
    "scalar.source_finite_adaptive_lower_lean_source",
    "scalar.source_gaussian_column_split_lean_source",
    "scalar.source_predictable_lower_lean_source",
    "scalar_hessian_tail_v4",
    "scalar_hessian_tail_v6",
    "scalar_value_comparator",
    "scalar_value_finite_cutoff_antecedent",
    "scalar_value_implementation",
    "scalar_value_type",
    "scope_281",
    "support-r2-13-finite-density-call",
    "support_backward_source",
    "support_certificate_lean_source",
    "support_certificate_source",
    "support_closure_lean_source",
    "support_closure_source",
    "support_coercivity_source",